{
  "$schema": "https://json-schema.org/draft/2020-12/schema",
  "$id": "https://example.invalid/v0-osap/schemas/v1.4.0/gate3_cluster_b_wp2_baseline_lock.schema.json",
  "title": "V0 OSAP Gate 3 Cluster B WP2 baseline lock",
  "type": "object",
  "additionalProperties": false,
  "required": [
    "artifact_id", "version", "date", "repository", "target_branch", "wp2_start",
    "canonical_wp1_merge_baseline", "frozen_v1_3_0_tag_target", "protected_inherited_surfaces",
    "authorized_new_surfaces", "release_actions_authorized"
  ],
  "properties": {
    "artifact_id": {"const": "V0_OSAP_GATE3_CLUSTER_B_WP2_BASELINE_LOCK"},
    "version": {"const": "0.1.2"},
    "date": {"const": "2026-07-21"},
    "repository": {"const": "olegovation-ship-it/v0-osap-formal-core"},
    "target_branch": {"const": "v1.4.0-development"},
    "wp2_start": {"const": "ffeaa3fd4fb2f85679f4695d5b28e333004ca24a"},
    "canonical_wp1_merge_baseline": {"const": "eaf142089230ea5a5096ae834bf4e733d5f369aa"},
    "frozen_v1_3_0_tag_target": {"const": "13bf095688bcabd5b090f188e9bd28a16237edeb"},
    "protected_inherited_surfaces": {"type": "array", "items": {"type": "string"}, "minItems": 4, "uniqueItems": true},
    "authorized_new_surfaces": {"type": "array", "items": {"type": "string"}, "minItems": 8, "uniqueItems": true},
    "release_actions_authorized": {"const": false}
  }
}
