{
  "artifact_id": "V0_OSAP_GATE3_CLUSTER_B_WP2_BASELINE_LOCK",
  "authorized_new_surfaces": [
    ".github/workflows/gate3-cluster-b-wp2.yml",
    "checker/v0_osap_fc1/cluster_b_wp2.py",
    "docs/gate3/cluster_b/WP2_*",
    "fixtures/gate3/cluster_b/wp2/",
    "release/v1.4.0/GATE3_CLUSTER_B_WP2_*",
    "schemas/v1.4.0/gate3_cluster_b_wp2_*",
    "scripts/build_gate3_cluster_b_wp2.py",
    "scripts/verify_gate3_cluster_b_wp2.py",
    "tests/conftest.py",
    "tests/test_gate3_cluster_b_wp2.py"
  ],
  "canonical_wp1_merge_baseline": "eaf142089230ea5a5096ae834bf4e733d5f369aa",
  "date": "2026-07-21",
  "frozen_v1_3_0_tag_target": "13bf095688bcabd5b090f188e9bd28a16237edeb",
  "protected_inherited_surfaces": [
    "release/v1.4.0/GATE3_CLUSTER_B_WP0_*",
    "release/v1.4.0/GATE3_CLUSTER_B_WP1_*",
    "docs/gate3/cluster_b/WP0_*",
    "docs/gate3/cluster_b/WP1_*",
    "tag:v1.3.0",
    "doi:10.5281/zenodo.21346728"
  ],
  "release_actions_authorized": false,
  "repository": "olegovation-ship-it/v0-osap-formal-core",
  "target_branch": "v1.4.0-development",
  "version": "0.1.2",
  "wp2_start": "ffeaa3fd4fb2f85679f4695d5b28e333004ca24a"
}
